{
  "source": "observed 27 Oct 2026 through the claude.ai connector of the same name (tool names as listed to the client); no tools/list was run; a subset of a list of over 200 tools; endpoint from vercel.com/blog/introducing-vercel-mcp-connect-vercel-to-your-ai-tools",
  "recordedAt": "2026-10-27",
  "tools": [
    {
      "name": "list_teams",
      "annotations": {
        "readOnlyHint": true,
        "destructiveHint": false,
        "idempotentHint": true,
        "openWorldHint": true
      }
    },
    {
      "name": "list_projects",
      "annotations": {
        "readOnlyHint": true,
        "destructiveHint": false,
        "idempotentHint": true,
        "openWorldHint": true
      }
    },
    {
      "name": "get_project",
      "annotations": {
        "readOnlyHint": true,
        "destructiveHint": false,
        "idempotentHint": true,
        "openWorldHint": true
      }
    },
    {
      "name": "list_deployments",
      "annotations": {
        "readOnlyHint": true,
        "destructiveHint": false,
        "idempotentHint": true,
        "openWorldHint": true
      }
    },
    {
      "name": "get_deployment",
      "annotations": {
        "readOnlyHint": true,
        "destructiveHint": false,
        "idempotentHint": true,
        "openWorldHint": true
      }
    },
    {
      "name": "get_runtime_logs",
      "annotations": {
        "readOnlyHint": true,
        "destructiveHint": false,
        "idempotentHint": true,
        "openWorldHint": true
      }
    },
    {
      "name": "get_runtime_errors",
      "annotations": {
        "readOnlyHint": true,
        "destructiveHint": false,
        "idempotentHint": true,
        "openWorldHint": true
      }
    },
    {
      "name": "search_vercel_documentation",
      "annotations": {
        "readOnlyHint": true,
        "destructiveHint": false,
        "idempotentHint": true,
        "openWorldHint": true
      }
    },
    {
      "name": "get_deployment_file_contents",
      "annotations": {
        "readOnlyHint": true,
        "destructiveHint": false,
        "idempotentHint": true,
        "openWorldHint": true
      }
    },
    {
      "name": "list_deployment_events",
      "annotations": {
        "readOnlyHint": true,
        "destructiveHint": false,
        "idempotentHint": true,
        "openWorldHint": true
      }
    }
  ],
  "dynamic": true
}
