{
  "source": "docker/mcp-gateway docs, dynamic MCP tools (note AP section 2.3: mcp-find, mcp-add, mcp-config-set, mcp-remove, mcp-exec, code-mode); the gateway otherwise forwards each profile server's tools under their own names; no tools/list was run",
  "recordedAt": "2026-10-27",
  "tools": [
    {
      "name": "mcp-find",
      "annotations": {
        "readOnlyHint": true,
        "destructiveHint": false,
        "idempotentHint": true,
        "openWorldHint": false
      },
      "inputSchema": {
        "type": "object"
      },
      "outputSchema": {
        "type": "object",
        "properties": {
          "content": {
            "type": "array"
          }
        }
      }
    },
    {
      "name": "mcp-add",
      "annotations": {
        "readOnlyHint": false,
        "destructiveHint": false,
        "idempotentHint": true,
        "openWorldHint": true
      },
      "inputSchema": {
        "type": "object"
      },
      "outputSchema": {
        "type": "object",
        "properties": {
          "content": {
            "type": "array"
          }
        }
      }
    },
    {
      "name": "mcp-config-set",
      "annotations": {
        "readOnlyHint": false,
        "destructiveHint": false,
        "idempotentHint": true,
        "openWorldHint": false
      },
      "inputSchema": {
        "type": "object"
      },
      "outputSchema": {
        "type": "object",
        "properties": {
          "content": {
            "type": "array"
          }
        }
      }
    },
    {
      "name": "mcp-remove",
      "annotations": {
        "readOnlyHint": false,
        "destructiveHint": true,
        "idempotentHint": true,
        "openWorldHint": false
      },
      "inputSchema": {
        "type": "object"
      },
      "outputSchema": {
        "type": "object",
        "properties": {
          "content": {
            "type": "array"
          }
        }
      }
    },
    {
      "name": "mcp-exec",
      "annotations": {
        "readOnlyHint": false,
        "destructiveHint": false,
        "idempotentHint": false,
        "openWorldHint": true
      },
      "inputSchema": {
        "type": "object"
      },
      "outputSchema": {
        "type": "object",
        "properties": {
          "content": {
            "type": "array"
          }
        }
      }
    },
    {
      "name": "code-mode",
      "annotations": {
        "readOnlyHint": false,
        "destructiveHint": false,
        "idempotentHint": false,
        "openWorldHint": true
      },
      "inputSchema": {
        "type": "object"
      },
      "outputSchema": {
        "type": "object",
        "properties": {
          "content": {
            "type": "array"
          }
        }
      }
    }
  ],
  "dynamic": true
}
