{
  "source": "crates/tk-daemon/src/computer_use/facade.rs at base 8bea68d: REQUEST_TOOL, STATUS_TOOL and LOOK_ONLY; every other tool is passed through from the helper's runtime (Cua Driver) with the facade's annotations (readOnlyHint false, destructiveHint true, openWorldHint false), so the list is the static part only",
  "recordedAt": "2026-10-27",
  "tools": [
    {
      "name": "request_app_access",
      "annotations": {
        "readOnlyHint": false,
        "destructiveHint": false,
        "idempotentHint": true,
        "openWorldHint": false
      },
      "inputSchema": {
        "type": "object"
      },
      "outputSchema": {
        "type": "object",
        "properties": {
          "content": {
            "type": "array"
          }
        }
      }
    },
    {
      "name": "computer_use_status",
      "annotations": {
        "readOnlyHint": true,
        "destructiveHint": false,
        "idempotentHint": true,
        "openWorldHint": false
      },
      "inputSchema": {
        "type": "object"
      },
      "outputSchema": {
        "type": "object",
        "properties": {
          "content": {
            "type": "array"
          }
        }
      }
    },
    {
      "name": "list_apps",
      "annotations": {
        "readOnlyHint": true,
        "destructiveHint": false,
        "idempotentHint": true,
        "openWorldHint": false
      },
      "inputSchema": {
        "type": "object"
      },
      "outputSchema": {
        "type": "object",
        "properties": {
          "content": {
            "type": "array"
          }
        }
      }
    },
    {
      "name": "list_windows",
      "annotations": {
        "readOnlyHint": true,
        "destructiveHint": false,
        "idempotentHint": true,
        "openWorldHint": false
      },
      "inputSchema": {
        "type": "object"
      },
      "outputSchema": {
        "type": "object",
        "properties": {
          "content": {
            "type": "array"
          }
        }
      }
    },
    {
      "name": "get_window_state",
      "annotations": {
        "readOnlyHint": true,
        "destructiveHint": false,
        "idempotentHint": true,
        "openWorldHint": false
      },
      "inputSchema": {
        "type": "object"
      },
      "outputSchema": {
        "type": "object",
        "properties": {
          "content": {
            "type": "array"
          }
        }
      }
    },
    {
      "name": "get_accessibility_tree",
      "annotations": {
        "readOnlyHint": true,
        "destructiveHint": false,
        "idempotentHint": true,
        "openWorldHint": false
      },
      "inputSchema": {
        "type": "object"
      },
      "outputSchema": {
        "type": "object",
        "properties": {
          "content": {
            "type": "array"
          }
        }
      }
    },
    {
      "name": "verify_state",
      "annotations": {
        "readOnlyHint": true,
        "destructiveHint": false,
        "idempotentHint": true,
        "openWorldHint": false
      },
      "inputSchema": {
        "type": "object"
      },
      "outputSchema": {
        "type": "object",
        "properties": {
          "content": {
            "type": "array"
          }
        }
      }
    },
    {
      "name": "parse_visual_regions",
      "annotations": {
        "readOnlyHint": true,
        "destructiveHint": false,
        "idempotentHint": true,
        "openWorldHint": false
      },
      "inputSchema": {
        "type": "object"
      },
      "outputSchema": {
        "type": "object",
        "properties": {
          "content": {
            "type": "array"
          }
        }
      }
    },
    {
      "name": "get_screen_size",
      "annotations": {
        "readOnlyHint": true,
        "destructiveHint": false,
        "idempotentHint": true,
        "openWorldHint": false
      },
      "inputSchema": {
        "type": "object"
      },
      "outputSchema": {
        "type": "object",
        "properties": {
          "content": {
            "type": "array"
          }
        }
      }
    },
    {
      "name": "get_cursor_position",
      "annotations": {
        "readOnlyHint": true,
        "destructiveHint": false,
        "idempotentHint": true,
        "openWorldHint": false
      },
      "inputSchema": {
        "type": "object"
      },
      "outputSchema": {
        "type": "object",
        "properties": {
          "content": {
            "type": "array"
          }
        }
      }
    },
    {
      "name": "zoom",
      "annotations": {
        "readOnlyHint": true,
        "destructiveHint": false,
        "idempotentHint": true,
        "openWorldHint": false
      },
      "inputSchema": {
        "type": "object"
      },
      "outputSchema": {
        "type": "object",
        "properties": {
          "content": {
            "type": "array"
          }
        }
      }
    },
    {
      "name": "get_session",
      "annotations": {
        "readOnlyHint": true,
        "destructiveHint": false,
        "idempotentHint": true,
        "openWorldHint": false
      },
      "inputSchema": {
        "type": "object"
      },
      "outputSchema": {
        "type": "object",
        "properties": {
          "content": {
            "type": "array"
          }
        }
      }
    }
  ],
  "dynamic": true
}
