{
  "source": "observed 27 Oct 2026 through the claude.ai connector of the same name (tool names as listed to the client); no tools/list was run; docker/mcp-registry servers/granola-remote marks the server dynamic (tools: true), so the list can grow",
  "recordedAt": "2026-10-27",
  "tools": [
    {
      "name": "list_meetings",
      "annotations": {
        "readOnlyHint": true,
        "destructiveHint": false,
        "idempotentHint": true,
        "openWorldHint": true
      }
    },
    {
      "name": "get_meetings",
      "annotations": {
        "readOnlyHint": true,
        "destructiveHint": false,
        "idempotentHint": true,
        "openWorldHint": true
      }
    },
    {
      "name": "search_meetings",
      "annotations": {
        "readOnlyHint": true,
        "destructiveHint": false,
        "idempotentHint": true,
        "openWorldHint": true
      }
    },
    {
      "name": "query_granola_meetings",
      "annotations": {
        "readOnlyHint": true,
        "destructiveHint": false,
        "idempotentHint": true,
        "openWorldHint": true
      }
    },
    {
      "name": "get_meeting_transcript",
      "annotations": {
        "readOnlyHint": true,
        "destructiveHint": false,
        "idempotentHint": true,
        "openWorldHint": true
      }
    },
    {
      "name": "get_meeting_attachment",
      "annotations": {
        "readOnlyHint": true,
        "destructiveHint": false,
        "idempotentHint": true,
        "openWorldHint": true
      }
    },
    {
      "name": "list_meeting_folders",
      "annotations": {
        "readOnlyHint": true,
        "destructiveHint": false,
        "idempotentHint": true,
        "openWorldHint": true
      }
    },
    {
      "name": "get_account_info",
      "annotations": {
        "readOnlyHint": true,
        "destructiveHint": false,
        "idempotentHint": true,
        "openWorldHint": false
      }
    },
    {
      "name": "create_folder",
      "annotations": {
        "readOnlyHint": false,
        "destructiveHint": false,
        "idempotentHint": true,
        "openWorldHint": true
      }
    },
    {
      "name": "update_folder",
      "annotations": {
        "readOnlyHint": false,
        "destructiveHint": false,
        "idempotentHint": true,
        "openWorldHint": true
      }
    },
    {
      "name": "add_note_to_folder",
      "annotations": {
        "readOnlyHint": false,
        "destructiveHint": false,
        "idempotentHint": true,
        "openWorldHint": true
      }
    },
    {
      "name": "remove_note_from_folder",
      "annotations": {
        "readOnlyHint": false,
        "destructiveHint": true,
        "idempotentHint": true,
        "openWorldHint": true
      }
    },
    {
      "name": "give_feedback",
      "annotations": {
        "readOnlyHint": false,
        "destructiveHint": false,
        "idempotentHint": true,
        "openWorldHint": true
      }
    },
    {
      "name": "sign_out",
      "annotations": {
        "readOnlyHint": false,
        "destructiveHint": true,
        "idempotentHint": true,
        "openWorldHint": true
      }
    }
  ],
  "dynamic": true
}
